[
  {
    "source_id": "SRC-0001",
    "canonical_name": "CISA Cybersecurity Advisories",
    "canonical_domain": "cisa.gov",
    "type": "GOV",
    "language": "en",
    "synthetic": false,
    "cited_in": [
      "TI-20260811-001",
      "TI-20260903-001"
    ],
    "admission": {
      "first_seen_url": "https://www.cisa.gov/news-events/cybersecurity-advisories/aa26-097a",
      "admitted": "2026-09-04T00:38:03Z",
      "assigned_type": "GOV",
      "type_basis": "assigned from publisher name and domain as cited in the issue's References list; not yet verified against a fetched about/masthead page (backfill admission, pre-fetch pass, CLAUDECODEBRIEF §9)",
      "domain_age_days": null,
      "impersonation_check": "no near-match against registry canonical domains",
      "review_flag": "first_citation",
      "reviewed": false
    },
    "live": {
      "unique_claims": 0,
      "citations": 0,
      "distribution": {},
      "record_status": "insufficient"
    },
    "backfill": {
      "unique_claims": 0,
      "citations": 0,
      "distribution": {},
      "record_status": "insufficient",
      "from_issues": [
        "TI-20260811-001",
        "TI-20260903-001"
      ]
    },
    "origin": "US"
  },
  {
    "source_id": "SRC-0002",
    "canonical_name": "ExtraHop",
    "canonical_domain": "extrahop.com",
    "type": "VND",
    "language": "en",
    "synthetic": false,
    "cited_in": [
      "TI-20260811-001"
    ],
    "admission": {
      "first_seen_url": "https://www.extrahop.com/blog/aoa-iranian-affiliated-actors-target-u-s-critical-infrastructure-through-plcs",
      "admitted": "2026-09-04T00:38:03Z",
      "assigned_type": "VND",
      "type_basis": "assigned from publisher name and domain as cited in the issue's References list; not yet verified against a fetched about/masthead page (backfill admission, pre-fetch pass, CLAUDECODEBRIEF §9)",
      "domain_age_days": null,
      "impersonation_check": "no near-match against registry canonical domains",
      "review_flag": "first_citation",
      "reviewed": false
    },
    "live": {
      "unique_claims": 0,
      "citations": 0,
      "distribution": {},
      "record_status": "insufficient"
    },
    "backfill": {
      "unique_claims": 0,
      "citations": 0,
      "distribution": {},
      "record_status": "insufficient",
      "from_issues": [
        "TI-20260811-001"
      ]
    },
    "origin": "US"
  },
  {
    "source_id": "SRC-0003",
    "canonical_name": "KELA Intelligence",
    "canonical_domain": "kelacyber.com",
    "type": "VND",
    "language": "en",
    "synthetic": false,
    "cited_in": [
      "TI-20260811-001"
    ],
    "admission": {
      "first_seen_url": "https://www.kelacyber.com/blog/irans-apts-and-the-us-enterprise-in-2026-muddywater/",
      "admitted": "2026-09-04T00:38:03Z",
      "assigned_type": "VND",
      "type_basis": "assigned from publisher name and domain as cited in the issue's References list; not yet verified against a fetched about/masthead page (backfill admission, pre-fetch pass, CLAUDECODEBRIEF §9)",
      "domain_age_days": null,
      "impersonation_check": "no near-match against registry canonical domains",
      "review_flag": "first_citation",
      "reviewed": false
    },
    "live": {
      "unique_claims": 0,
      "citations": 0,
      "distribution": {},
      "record_status": "insufficient"
    },
    "backfill": {
      "unique_claims": 0,
      "citations": 0,
      "distribution": {},
      "record_status": "insufficient",
      "from_issues": [
        "TI-20260811-001"
      ]
    }
  },
  {
    "source_id": "SRC-0004",
    "canonical_name": "The Washington Post",
    "canonical_domain": "washingtonpost.com",
    "type": "MED",
    "language": "en",
    "synthetic": false,
    "cited_in": [
      "TI-20260811-001"
    ],
    "admission": {
      "first_seen_url": "https://www.washingtonpost.com/national-security/2026/07/30/us-spy-agencies-suspect-iran-launched-cyberattack-minnesota-water-facilities/",
      "admitted": "2026-09-04T00:38:03Z",
      "assigned_type": "MED",
      "type_basis": "assigned from publisher name and domain as cited in the issue's References list; not yet verified against a fetched about/masthead page (backfill admission, pre-fetch pass, CLAUDECODEBRIEF §9)",
      "domain_age_days": null,
      "impersonation_check": "no near-match against registry canonical domains",
      "review_flag": "first_citation",
      "reviewed": false
    },
    "live": {
      "unique_claims": 0,
      "citations": 0,
      "distribution": {},
      "record_status": "insufficient"
    },
    "backfill": {
      "unique_claims": 0,
      "citations": 0,
      "distribution": {},
      "record_status": "insufficient",
      "from_issues": [
        "TI-20260811-001"
      ]
    },
    "origin": "US"
  },
  {
    "source_id": "SRC-0005",
    "canonical_name": "Rescana",
    "canonical_domain": "rescana.com",
    "type": "VND",
    "language": "en",
    "synthetic": false,
    "cited_in": [
      "TI-20260811-001"
    ],
    "admission": {
      "first_seen_url": "https://www.rescana.com/post/rustywater-iranian-muddywater-apt-targets-israeli-government-and-infrastructure-with-advanced-rust",
      "admitted": "2026-09-04T00:38:03Z",
      "assigned_type": "VND",
      "type_basis": "assigned from publisher name and domain as cited in the issue's References list; not yet verified against a fetched about/masthead page (backfill admission, pre-fetch pass, CLAUDECODEBRIEF §9)",
      "domain_age_days": null,
      "impersonation_check": "no near-match against registry canonical domains",
      "review_flag": "first_citation",
      "reviewed": false
    },
    "live": {
      "unique_claims": 0,
      "citations": 0,
      "distribution": {},
      "record_status": "insufficient"
    },
    "backfill": {
      "unique_claims": 0,
      "citations": 0,
      "distribution": {},
      "record_status": "insufficient",
      "from_issues": [
        "TI-20260811-001"
      ]
    }
  },
  {
    "source_id": "SRC-0006",
    "canonical_name": "SafeBreach",
    "canonical_domain": "safebreach.com",
    "type": "VND",
    "language": "en",
    "synthetic": false,
    "cited_in": [
      "TI-20260811-001"
    ],
    "admission": {
      "first_seen_url": "https://www.safebreach.com/blog/cisa-aa26-097a-iranian-plc-exploitation-safebreach-coverage/",
      "admitted": "2026-09-04T00:38:03Z",
      "assigned_type": "VND",
      "type_basis": "assigned from publisher name and domain as cited in the issue's References list; not yet verified against a fetched about/masthead page (backfill admission, pre-fetch pass, CLAUDECODEBRIEF §9)",
      "domain_age_days": null,
      "impersonation_check": "no near-match against registry canonical domains",
      "review_flag": "first_citation",
      "reviewed": false
    },
    "live": {
      "unique_claims": 0,
      "citations": 0,
      "distribution": {},
      "record_status": "insufficient"
    },
    "backfill": {
      "unique_claims": 0,
      "citations": 0,
      "distribution": {},
      "record_status": "insufficient",
      "from_issues": [
        "TI-20260811-001"
      ]
    },
    "origin": "US"
  },
  {
    "source_id": "SRC-0007",
    "canonical_name": "SOCRadar",
    "canonical_domain": "socradar.io",
    "type": "VND",
    "language": "en",
    "synthetic": false,
    "cited_in": [
      "TI-20260811-001",
      "TI-20260830-002"
    ],
    "admission": {
      "first_seen_url": "https://socradar.io/blog/iranian-hackers-plc-us-critical-infrastructure/",
      "admitted": "2026-09-04T00:38:03Z",
      "assigned_type": "VND",
      "type_basis": "assigned from publisher name and domain as cited in the issue's References list; not yet verified against a fetched about/masthead page (backfill admission, pre-fetch pass, CLAUDECODEBRIEF §9)",
      "domain_age_days": null,
      "impersonation_check": "no near-match against registry canonical domains",
      "review_flag": "first_citation",
      "reviewed": false
    },
    "live": {
      "unique_claims": 0,
      "citations": 0,
      "distribution": {},
      "record_status": "insufficient"
    },
    "backfill": {
      "unique_claims": 0,
      "citations": 0,
      "distribution": {},
      "record_status": "insufficient",
      "from_issues": [
        "TI-20260811-001",
        "TI-20260830-002"
      ]
    }
  },
  {
    "source_id": "SRC-0008",
    "canonical_name": "Tech Times",
    "canonical_domain": "techtimes.com",
    "type": "MED",
    "language": "en",
    "synthetic": false,
    "cited_in": [
      "TI-20260809-001",
      "TI-20260811-001",
      "TI-20260903-001"
    ],
    "admission": {
      "first_seen_url": "https://www.techtimes.com/articles/321335/20260723/iranian-hackers-infiltrate-siemens-schneider-plcs-blinding-operators-fake-readings.htm",
      "admitted": "2026-09-04T00:38:03Z",
      "assigned_type": "MED",
      "type_basis": "assigned from publisher name and domain as cited in the issue's References list; not yet verified against a fetched about/masthead page (backfill admission, pre-fetch pass, CLAUDECODEBRIEF §9)",
      "domain_age_days": null,
      "impersonation_check": "no near-match against registry canonical domains",
      "review_flag": "first_citation",
      "reviewed": false
    },
    "live": {
      "unique_claims": 0,
      "citations": 0,
      "distribution": {},
      "record_status": "insufficient"
    },
    "backfill": {
      "unique_claims": 0,
      "citations": 0,
      "distribution": {},
      "record_status": "insufficient",
      "from_issues": [
        "TI-20260809-001",
        "TI-20260811-001",
        "TI-20260903-001"
      ]
    },
    "origin": "US"
  },
  {
    "source_id": "SRC-0009",
    "canonical_name": "Trellix",
    "canonical_domain": "trellix.com",
    "type": "VND",
    "language": "en",
    "synthetic": false,
    "cited_in": [
      "TI-20260811-001"
    ],
    "admission": {